date,id,parentId,level,name,grade,jobTitle,unit,salaryCostOfReports,payFloor,payCeil,professionalOccupationalGroup
Oct-15,CMO-038,CMO-002,Senior,N/D,SCS1,Deputy Director - Clinical Excellence Awards Policy,Chief Medical Officer's Private Office,317007,ND,,Policy
Oct-15,PHD-063,PHD-019,Senior,N/D,SCS1,"Deputy Director, Obesity and Food Policy",Public Health Directorate,772780,ND,,Policy
Oct-15,SC-077,SC-022,Senior,N/D,SCS1,Deputy Director for Maternity & Child Health,Social Care Local Government & Care Partnerships Directorate,653718,ND,,Policy
Oct-15,IGT2358,IGT2355,Senior,N/D,SCS1,"Deputy Director - Office for Life Sciences, Health Innovation","Innovation, Growth and Technology",0,ND,,Policy
Oct-15,FN-NHSEFP-116,FN140,Senior,Peter Sellars,SCS2,Director of Estates and Facilities,Finance & NHS,323375,45000,49999,Policy
Oct-15,IGT2359,IGT2355,Senior,N/D,SCS1,"Deputy Director - Office for Life Sciences, Health Innovation","Innovation, Growth and Technology",0,ND,,Policy
Oct-15,IGT-2004,IGT-101,Senior,N/D,SCS1,Senior Technical Advisor,"Innovation, Growth and Technology",0,ND,,Policy
Oct-15,PHD-067,PHD-017,Senior,N/D,SCS1,Head of Health Protection Analytical team,Public Health Directorate,597884,ND,,Policy
Oct-15,SER106,IGO-005,Senior,N/D,SCS1,Deputy Director - Strategic Engagement,Group Operations,0,ND,,Policy
Oct-15,FN146,FN-PICD-033,Senior,N/D,SCS1,Head of NHS Litigaton Improvement Programme,Finance & NHS,0,ND,,Policy
Oct-15,SER-2388N,SER-004,Senior,N/D,SCS1,Deputy Director - NHS Cost Recovery programme,Strategy and External Relations,0,ND,,Policy
Oct-15,PHD78,PHD-019,Senior,N/D,SCS1,Deputy Director - Obesity and Diabetes,Public Health Directorate,0,ND,,Policy
Oct-15,IGO-012,IGO-005,Senior,Marion Furr,SCS2,Director Ministerial Business & Parliamentary Accountability,Group Operations,2736741,60000,64999,Operational Delivery
Oct-15,FN144,FN131,Senior,N/D,SCS1,Deputy Director - Delivery Team,Finance & NHS,0,ND,,Policy
Oct-15,IGO-121,IGO-015,Senior,N/D,SCS1,Deputy Director - Head of Internal Audit,Group Operations,622703,ND,,Operational Delivery
Oct-15,FN-GFM-276,FN-GFM-027,Senior,N/D,SCS1,Deputy Director-Finance Operations,Finance & NHS,1400665,ND,,Finance
Oct-15,SER-2310,SER-1945,Senior,N/D,SCS1,"Deputy Director, Quality Improvement",Strategy and External Relations,461156,ND,,Policy
Oct-15,SC-074,SC-026,Senior,N/D,SCS1,Deputy Director for Mental Health Policy & Strategy,Social Care Local Government & Care Partnerships Directorate,491126,ND,,Policy
Oct-15,SC-024,SC-023,Senior,N/D,SCS1,Deputy Director - Strategic Policy & Finance,Social Care Local Government & Care Partnerships Directorate,678570,ND,,Policy
Oct-15,FN145,FN-PICD-108,Senior,N/D,SCS1,"Deputy Director - Growth, Policy and Customer Relations",Finance & NHS,0,ND,,Policy
Oct-15,IGT2366,IGT2355,Senior,N/D,SCS1,Deputy Director - Genomics,"Innovation, Growth and Technology",0,ND,,Policy
Oct-15,FN-FP-111,FN-FP-030,Senior,N/D,SCS1,Deputy Director of Financial Policy & Strategy,Finance & NHS,0,ND,,Policy
Oct-15,SC-212,SC-023,Senior,N/D,SCS1,Deputy Director - Local Government and Regional Policy,Social Care Local Government & Care Partnerships Directorate,417921,ND,,Policy
Oct-15,IGT2357,IGT-028,Senior,N/D,SCS1,Deputy Director - Community Pharmacy,"Innovation, Growth and Technology",0,ND,,Policy
Oct-15,FN-GFM-099,FN-GFM-027,Senior,N/D,SCS1,Deputy Director - Provider Finance,Finance & NHS,323104,ND,,Finance
Oct-15,FN-NHSG-2025,FN-NHSG-031,Senior,N/D,SCS1,Deputy Director - NHS Efficiency,Finance & NHS,1107324,ND,,Policy
Oct-15,SC2250,SC-003,Senior,N/D,SCS1,Head of Dementia Innovation Unit,Social Care Local Government & Care Partnerships Directorate,0,ND,,Policy
Oct-15,IGT2368,IGT2355,Senior,N/D,SCS1,Head of Accelerated Access Review,"Innovation, Growth and Technology",483947,ND,,Policy
Oct-15,RDD-041,RDD-009,Senior,N/D,SCS1,Deputy Director - Research Finance & Programmes,Research & Development Directorate,1036368,ND,,Policy
Oct-15,FN-GFM-2008,FN-GFM-027,Senior,N/D,SCS1,Deputy Director - Accounts,Finance & NHS,1603837,ND,,Finance
Oct-15,FN-FP-2082,FN-FP-030,Senior,N/D,SCS1,Deputy Director - Performance Insight,Finance & NHS,0,ND,,Policy
Oct-15,SC-086,SC-023,Senior,N/D,SCS1,Deputy Director - Social Care Policy & Legislation,Social Care Local Government & Care Partnerships Directorate,663194,ND,,Policy
Oct-15,SC-2249,SC-023,Senior,N/D,SCS1,"Deputy Director - Prevention, Integration and Ageing",Social Care Local Government & Care Partnerships Directorate,0,ND,,Policy
Oct-15,IGT-118,IGT-028,Senior,N/D,SCS1,"Deputy Director - Pricing, Prescriptions and Supply","Innovation, Growth and Technology",957400,ND,,Policy
Oct-15,IGO-049,IGO-016,Senior,N/D,SCS1,Head of Workplace Operations,Group Operations,1686235,ND,,Information Technology
Oct-15,PHD80,PHD-020,Senior,N/D,SCS1,"Deputy Director - Emergency Preparedness, Resilience and Response",Public Health Directorate,486907,ND,,Policy
Oct-15,PHD-073,PHD-020,Senior,N/D,SCS1,Deputy Director EPRR Threats,Public Health Directorate,407618,ND,,Policy
Oct-15,IGO2186,IGO-005,Senior,N/D,SCS1,Deputy Director - Implementation Unit,Group Operations,0,ND,,Operational Delivery
Oct-15,IGT-101,IGT-028,Senior,N/D,SCS1,Deputy Director - Clinical & Cost Effectiveness,"Innovation, Growth and Technology",708855,ND,,Policy
Oct-15,SC-080,SC-026,Senior,N/D,SCS1,Deputy Director - Dementia ( domestic),Social Care Local Government & Care Partnerships Directorate,0,ND,,Policy
Oct-15,IGO-056,IGO-012,Senior,N/D,SCS1,Principal Private Secretary - Office of the Permanent Secretary,Group Operations,0,ND,,Operational Delivery
Oct-15,IGT2360,IGT2355,Senior,VACANT,SCS1,"Deputy Director, Sector Policy","Innovation, Growth and Technology",0,ND,,Policy
Oct-15,SC-087,SC-023,Senior,N/D,SCS1,Deputy Director - Integration,Social Care Local Government & Care Partnerships Directorate,302115,ND,,Policy
Oct-15,IGO-2170,IGO-015,Senior,N/D,SCS1,"Deputy Director Information and Legal, Legacy Management Team",Group Operations,491312,ND,,Programme and Project Management (PPM)
Oct-15,FN-NHSG-117,FN-NHSG-031,Senior,N/D,SCS1,"Deputy Director - Legislation, Constitution & Policy Improvement",Finance & NHS,788279,ND,,Policy
Oct-15,SER-1957,SER-1945,Senior,N/D,SCS1,Deputy Director - Citizen Voice and Insight,Strategy and External Relations,572603,ND,,Policy
Oct-15,FN-NHSG-2023,FN-NHSG-031,Senior,N/D,SCS1,Deputy Director of NHS Policy and Strategy Unit,Finance & NHS,730350,ND,,Policy
Oct-15,IGT2361,IGT-010,Senior,N/D,SCS1,Deputy Director - Policy & Strategy,"Innovation, Growth and Technology",1053867,ND,,Policy
Oct-15,IGO-1831,IGO-015,Senior,N/D,SCS1,Deputy Director of Governance Unit,Group Operations,413815,ND,,Operational Delivery
Oct-15,SER-283,IGO2185,Senior,N/D,SCS1,Deputy Director of Strategy,Group Operations,295542,ND,,Policy
Oct-15,SC-088,SC-022,Senior,N/D,SCS1,Deputy Director - Equalities and Social Inclusion,Social Care Local Government & Care Partnerships Directorate,1028520,ND,,Policy
Oct-15,SER-2433N,SER-1945,Senior,N/D,SCS1,"Deputy Director, Secretary to the Gosport Investigation",Strategy and External Relations,446416,ND,,Other
Oct-15,FN-FP-098,FN-FP-030,Senior,N/D,SCS1,"Deputy Director of Financial Planning, Monitoring and Analysis",Finance & NHS,0,ND,,Finance
Oct-15,IGT2352,IGT-2351,Senior,N/D,SCS1,Deputy Director,"Innovation, Growth and Technology",0,ND,,Operational Delivery
Oct-15,IGO-034,IGO-012,Senior,VACANT,SCS1,Principal Private Secretary to the Secretary of State,Group Operations,1613812,ND,,Operational Delivery
Oct-15,IGO2185,IGO-005,Senior,Kristen McLeod,SCS2,"Director - Strategy, Implementation and Planning",Group Operations,461029,85000,89999,Policy
Oct-15,PHD-1876,PHD-068,Senior,N/D,SCS1,"Deputy Director Genomics, science and emerging technologies",Public Health Directorate,278733,ND,,Policy
Oct-15,PHD-1878,PHD-068,Senior,N/D,SCS1,Deputy Director - Screening and sexual health,Public Health Directorate,322293,ND,,Policy
Oct-15,PHD-1913,PHD-068,Senior,N/D,SCS1,Deputy Director Health Proterction System and Immunisation,Public Health Directorate,434350,ND,,Policy
Oct-15,IGT2362,IGT-010,Senior,N/D,SCS1,Deputy Director - Digital Transformation and Services,"Innovation, Growth and Technology",616343,ND,,Policy
Oct-15,SER-045,SER-1945,Senior,N/D,SCS1,Deputy Director - Professional Standards,Strategy and External Relations,1310956,ND,,Policy
Oct-15,IGO-053,IGO-014,Senior,N/D,SCS1,"Deputy Director, HR Service Delivery",Group Operations,694832,ND,,Human Resources
Oct-15,SER-120,IGO2185,Senior,N/D,SCS1,Deputy Director Strategy Group,Group Operations,0,ND,,Policy
Oct-15,PHD-065,PHD-020,Senior,N/D,SCS1,Deputy Director -Health Protection Programmes,Public Health Directorate,606835,ND,,Policy
Oct-15,PHD-072,PHD-017,Senior,N/D,SCS1,Head of EU and Global Affairs,Public Health Directorate,1081033,ND,,Policy
Oct-15,SC-082,SC-023,Senior,N/D,SCS1,Deputy Director - Quality & Safety,Social Care Local Government & Care Partnerships Directorate,533758,ND,,Policy
Oct-15,FN-PICD-107,FN-PICD-033,Senior,N/D,SCS1,Deputy Director Procurement,Finance & NHS,1796428,ND,,Procurement
Oct-15,SC-078,SC-026,Senior,N/D,SCS1,Deputy Director -Learning Disability & Autism,Social Care Local Government & Care Partnerships Directorate,503323,ND,,Policy
Oct-15,IGO-054,IGO-015,Senior,N/D,SCS1,Deputy Director of Assurance and Public Appointments,Group Operations,1124919,ND,,Operational Delivery
Oct-15,SC2253,SC-003,Senior,N/D,SCS1,Deputy Director Work & Health Joint Unit,Social Care Local Government & Care Partnerships Directorate,0,ND,,Policy
Oct-15,FN-PICD-125,FN-PICD-033,Senior,N/D,SCS1,Deputy Director for Property,Finance & NHS,1313372,ND,,Finance
Oct-15,IGT-100,IGT-028,Senior,N/D,SCS1,Deputy Director - Senior Economic Advisor,"Innovation, Growth and Technology",523174,ND,,Economics
Oct-15,SER-1951,SER-011,Senior,N/D,SCS1,Deputy Director Workforce Development Strategy,Strategy and External Relations,796569,ND,,Policy
Oct-15,FN-PICD-108,FN140,Senior,N/D,SCS1,Deputy Director for Commercial Policy,Finance & NHS,2042432,ND,,Procurement
Oct-15,IGT2353,IGT-010,Senior,N/D,SCS1,Deputy Director - External Partnerships,"Innovation, Growth and Technology",530822,ND,,Operational Delivery
Oct-15,SER-036,SER-1945,Senior,N/D,SCS1,Deputy Director - CQC Sponsorship/Quality Regulation and DH Investigations,Strategy and External Relations,534224,ND,,Policy
Oct-15,PSF042,IGO2187,Senior,N/D,SCS1,Deputy Director - HR Business Change,Group Operations,0,ND,,Human Resources
Oct-15,PHD-061,PHD-068,Senior,N/D,SCS1,"Deputy Director Human Tissue,Embryology and Assisted Reproduction",Public Health Directorate,336443,ND,,Policy
Oct-15,RDD-040,RDD-009,Senior,N/D,SCS1,"Deputy Director - Sponsorship, Performance and Workforce",Research & Development Directorate,0,ND,,Policy
Oct-15,IGT-102,IGT2355,Senior,N/D,SCS1,Deputy Director - Office for Life Sciences,"Innovation, Growth and Technology",0,ND,,Policy
Oct-15,SC2252,SC-003,Senior,N/D,SCS1,Head of Work & Health Joint Unit,Social Care Local Government & Care Partnerships Directorate,353378,ND,,Policy
Oct-15,SER-043,SER-011,Senior,N/D,SCS1,"Deputy Director - NHS Pay, Pensions & Employment Services",Strategy and External Relations,733442,ND,,Policy
Oct-15,IGT-109,IGT-028,Senior,N/D,SCS1,Deputy Director Commercial Medicines Unit,"Innovation, Growth and Technology",2116861,ND,,Procurement
Oct-15,SC-076,SC-023,Senior,N/D,SCS1,Deputy Director - Care Provider Continuity,Social Care Local Government & Care Partnerships Directorate,0,ND,,Policy
Oct-15,PHD-071,PHD-019,Senior,N/D,SCS1,Deputy Director - Alcohol and Drugs Policy,Public Health Directorate,269364,ND,,Policy
Oct-15,PHD066,PHD-017,Senior,N/D,SCS1,Deputy Director - Public Health Policy & Strategy,Public Health Directorate,485224,ND,,Policy
Oct-15,IGO-051,IGO-016,Senior,N/D,SCS1,Head of Business Support & Engagement,Group Operations,1601189,ND,,Property and asset management
Oct-15,SER-042,SER-013,Senior,N/D,SCS1,Deputy Director - Corporate Engagement,Strategy and External Relations,731837,ND,,Policy
Oct-15,PHD077,PHD-068,Senior,N/D,SCS1,Deputy Director - Ebola Team,Public Health Directorate,0,ND,,Policy
Oct-15,SER-055,SER-004,Senior,N/D,SCS1,Deputy Director - Global Summit on Patient Safety & Connecting,Strategy and External Relations,334227,ND,,Operational Delivery
Oct-15,IGO-050,IGO-014,Senior,N/D,SCS1,"Deputy Director - HR Operations & SCS Unit, HR Change Team",Group Operations,833591,ND,,Human Resources
Oct-15,RDD-039,RDD-009,Senior,N/D,SCS1,Acting Deputy Director - Research Infrastructure and Growth,Research & Development Directorate,334838,ND,,Policy
Oct-15,SC-023,SC-003,Senior,Clara Swinson,SCS2,Director of Social Care Policy,Social Care Local Government & Care Partnerships Directorate,987774,80000,84999,Policy
Oct-15,FN128,FN-GFM-027,Senior,N/D,SCS1,Deputy Director - Financial Control,Finance & NHS,971876,ND,,Finance
Oct-15,SER-1946,SER-011,Senior,N/D,SCS1,Deputy Director Workforce Capacity and Information,Strategy and External Relations,425407,ND,,Policy
Oct-15,SC-079,SC-026,Senior,N/D,SCS1,"Deputy Director - Armed Forces and Offender Health, Mental Health Legislation",Social Care Local Government & Care Partnerships Directorate,639791,ND,,Policy
Oct-15,PHD-066,PHD-019,Senior,N/D,SCS1,Deputy Director - Health Visitor programme and healthy foods,Public Health Directorate,421759,ND,,Policy
Oct-15,FN-NHSG-112,FN-NHSG-031,Senior,N/D,SCS1,"Deputy Director, NHS Personalisation and Regulation",Finance & NHS,0,ND,,Policy
Oct-15,IGO-2184,IGO-015,Senior,N/D,SCS1,Deputy Director - NHS Security,Group Operations,0,ND,,Procurement
Oct-15,FN-GFM-115,FN-GFM-027,Senior,N/D,SCS1,Interim Director - Finance Business Partners,Finance & NHS,892186,ND,,Finance
Oct-15,PHD-1893,PHD-017,Senior,N/D,SCS1,Head of Health improvement Analytical Team,Public Health Directorate,1071668,ND,,Policy
Oct-15,SER-044,SER-011,Senior,N/D,SCS1,Deputy Director Workforce Analysis,Strategy and External Relations,412954,ND,,Policy
Oct-15,PHD-062,PHD-020,Senior,N/D,SCS1,"Deputy Director CBRN, Environmental Threats and Hazards",Public Health Directorate,0,ND,,Policy
Oct-15,FN-NHSG-2240,FN-NHSG-031,Senior,N/D,SCS1,"Deputy Director, NHS Clinical Services",Finance & NHS,803573,ND,,Policy
Oct-15,PHD-069,PHD-019,Senior,N/D,SCS1,Deputy Director - Tobacco and Health Improvement Policy,Public Health Directorate,552893,ND,,Policy
Oct-15,SC-209,SC-023,Senior,N/D,SCS1,"Deputy Director and Lead Analyst for Social Care, Local Government and Care Partnerships",Social Care Local Government & Care Partnerships Directorate,715536,ND,,Policy
Oct-15,IGO-016,IGO-005,Senior,Dominic Brankin,SCS2,Director of Workplace and Transformation,Group Operations,997595,85000,89999,Programme and Project Management (PPM)
Oct-15,SER-1945,SER-004,Senior,William Vineall,SCS2,Director of Quality,Strategy and External Relations,462331,85000,89999,Policy
Oct-15,IGT2367,IGT-2351,Senior,N/D,SCS1,Deputy Director - Head of Informatics Portfolio Management,"Innovation, Growth and Technology",0,ND,,Policy
Oct-15,IGO2187,IGO-015,Senior,N/D,SCS1,Deputy Director - Corporate Services Improvement Programme,Group Operations,0,ND,,Policy
Oct-15,IGT-097,IGT-028,Senior,N/D,SCS1,Deputy Director - Head of Pharmacy,"Innovation, Growth and Technology",430141,ND,,Policy
Oct-15,PHD-017,PHD-006,Senior,Kathryn Tyson,SCS2,"Director, International Health and Public Health Policy",Public Health Directorate,420842,85000,89999,Policy
Oct-15,SER-048,SER-013,Senior,N/D,SCS1,Deputy Director - Policy & NHS Communications,Strategy and External Relations,1346425,ND,,Communications
Oct-15,FN-FP-2060,FN-FP-030,Senior,N/D,SCS1,Chief Analyst - Deputy Director - Office of the Chief Analyst,Finance & NHS,658642,ND,,Operational Delivery
Oct-15,SC-075,SC-022,Senior,N/D,SCS1,Deputy Director - Developing Well,Social Care Local Government & Care Partnerships Directorate,409115,ND,,Policy
Oct-15,IGO-058,IGO-016,Senior,N/D,SCS1,Head of ICT Futures & Shared Services,Group Operations,655430,ND,,Information Technology
Oct-15,FN-FP-030,FN131,Senior,Andrew Sanderson,SCS2,Director Financial Planning,Finance & NHS,3021521,85000,89999,Policy
Oct-15,PHD-020,PHD-006,Senior,Helen Shirley Quirk,SCS2,"Director, Health Protection & Emergency Response",Public Health Directorate,470356,85000,89999,Policy
Oct-15,PHD-068,PHD-006,Senior,Paul Macnaught,SCS2,Director – Health Science & Bioethics,Public Health Directorate,559256,85000,89999,Policy
Oct-15,SER-046,SER-013,Senior,N/D,SCS1,Deputy Director - Media Centre,Strategy and External Relations,1140814,ND,,Communications
Oct-15,FN-PICD-104,FN-PICD-033,Senior,N/D,SCS1,Deputy Director for Companies and Ventures,Finance & NHS,554519,ND,,Finance
Oct-15,FN141,FN131,Senior,Samantha Foley,SCS2,Director of the Government Finance Academy,Finance & NHS,120804,90000,94999,Finance
Oct-15,SER-060,SER-1945,Senior,N/D,SCS1,"Head of the Nursing, Midwifery and Allied Health Professions Policy Unit, Quality Division",Strategy and External Relations,347360,ND,,Policy
Oct-15,PHD-064,PHD-020,Senior,N/D,SCS1,Deputy Director Infectious Diseases,Public Health Directorate,650790,ND,,Policy
Oct-15,PHD-019,PHD-006,Senior,Mark Davies,SCS2,Director of Health and Wellbeing,Public Health Directorate,680953,95000,99999,Policy
Oct-15,FN140,FN131,Senior,Jeremy Marlow,SCS2,Director of Productivity and Efficiency,Finance & NHS,455593,100000,104999,Policy
Oct-15,RDD-037,RDD-009,Senior,N/D,SCS1,"Deputy Director - Research Contracting, Information Intelligence and Stakeholder Engagement",Research & Development Directorate,383587,ND,,Policy
Oct-15,FN-GFM-2476,FN-GFM-027,Senior,N/D,SCS1,Deputy Director - Anti-Fraud Unit,Finance & NHS,0,ND,,Policy
Oct-15,IGT-028,IGT-2351,Senior,Liz Woodeson,SCS2,Director - Medicines Pharmacy and Industry Group,"Innovation, Growth and Technology",678949,105000,109999,Policy
Oct-15,IGO-015,IGO-005,Senior,Stephen Waring,SCS2,Director - Group Assurance,Group Operations,1054412,105000,109999,Policy
Oct-15,SER-013,SER-004,Senior,Sam Lister,SCS2,Director - Communications,Strategy and External Relations,911599,115000,119999,Communications
Oct-15,SER-011,SER-004,Senior,Giles Denham,SCS2,Director of Workforce,Strategy and External Relations,607940,115000,119999,Policy
Oct-15,SC-026,SC-003,Senior,Sarah McClinton,SCS2,"Director, Mental Health, Disability and Dementia",Social Care Local Government & Care Partnerships Directorate,409532,120000,124999,Policy
Oct-15,FN-NHSG-031,FN131,Senior,Ben Dyson,SCS2,Director of NHS Group (Secondee In),Finance & NHS,622300,120000,124999,Policy
Oct-15,SC-022,SC-003,Senior,Flora Goldhill,SCS2,"Director for Children, Families and Social Inclusion",Social Care Local Government & Care Partnerships Directorate,462420,120000,124999,Policy
Oct-15,IGO-005,SER-001,Senior,Tamara Finkelstein,SCS3,Chief Operating Officer,Group Operations,931768,120000,124999,Operational Delivery
Oct-15,IGT-2351,SER-001,Senior,William Cavendish,SCS3,"Director General for Innovation, Growth & Technology","Innovation, Growth and Technology",588861,120000,124999,Operational Delivery
Oct-15,FN-GFM-027,FN131,Senior,Andrew Baigent,SCS2,Director - Group Financial Management,Finance & NHS,554451,125000,129999,Finance
Oct-15,IGO-014,IGO-005,Senior,Shirley Pointer,SCS2,Director of Human Resources,Group Operations,740792,125000,129999,Human Resources
Oct-15,RDD-009,CMO-002,Senior,Russell Hamilton,SCS2,Director of Research & Development,Research & Development Directorate,763092,130000,134999,Policy
Oct-15,SER-004,SER-001,Senior,Charlie Massey,SCS3,Director General - Strategy & External Relations,Strategy and External Relations,647444,130000,134999,Policy
Oct-15,PHD-006,SER-001,Senior,Felicity Harvey,SCS3,Director General for Public and International Health,Public Health Directorate,529248,135000,139999,Policy
Oct-15,FN131,SER-001,Senior,David Williams,SCS3,"Director General, Finance, Commercial and NHS",Finance & NHS,441256,135000,139999,Finance
Oct-15,SC-003,SER-001,Senior,Jon Rouse,SCS3,"Director General for Social Care, Local Government & Care Partnerships",Social Care Local Government & Care Partnerships Directorate,962102,140000,144999,Policy
Oct-15,FN-PICD-033,FN131,Senior,Patrick Mills,SCS2,Commercial Director,Finance & NHS,965861,155000,159999,Finance
Oct-15,SER-001,,Senior,Una O'Brien,SCS4,Permanent Secretary of the Department of Health,Group Operations,0,160000,164999,Operational Delivery
Oct-15,CMO-002,SER-001,Senior,Professor Dame Sally Davies,SCS3,Chief Medical Officer,Chief Medical Officer's Private Office,396970,200000,204999,Medicine
Oct-15,IGT-010,IGT-2351,Senior,VACANT,SCS2,"Director, Partnerships & Information","Innovation, Growth and Technology",266700,0,0,Policy
Oct-15,IGO-057,IGO-014,Senior,N/D,SCS1,Deputy Director - HR Business Partnering & Capability Development,Group Operations,0,ND,,Human Resources
Oct-15,GOA061,IGO-2170,Senior,ELIMINATED,SCS1,Programme Director National Proton Beam Therapy Programme,Group Operations,0,ND,,Programme and Project Management (PPM)
Oct-15,SER-2196,SER-004,Senior,ELIMINATED,SCS2,Chief Analyst and Director of Strategy,Strategy and External Relations,0,0,0,Operational Delivery
Oct-15,FN-DG-007,SER-001,Senior,ELIMINATED,SCS3,Director General for Finance & NHS,Finance & NHS,0,0,0,Finance
Oct-15,FN-MPI-096,FN-NHSG-031,Senior,ELIMINATED,SCS1,Deputy Director - Dental and Eye Care Services,Finance & NHS,0,ND,,Policy
Oct-15,FN-NHSG-095,FN-NHSG-031,Senior,VACANT,SCS1,Deputy Director - NHS Commissioning,Finance & NHS,0,ND,,Policy
Oct-15,FN-DG-052,FN-DG-007,Senior,ELIMINATED,SCS1,"Deputy Director, Accountability & Regulation",Finance & NHS,0,ND,,Policy
Oct-15,PR004,FN-NHSG-031,Senior,ELIMINATED,SCS1,Deputy Director - Economic Regulation,Finance & NHS,0,ND,,Policy
Oct-15,PSF021,FN-FP-030,Senior,VACANT,SCS1,Deputy Director Strategy Group and Senior Strategy Adviser,Finance & NHS,0,ND,,Policy
Oct-15,PSF039,FN-FP-030,Senior,VACANT,SCS1,Deputy Director OCA and Head of Profession for Statistics,Finance & NHS,0,ND,,Statisticians
Oct-15,SC-025,SC-003,Senior,ELIMINATED,SCS2,Special Projects,Social Care Local Government & Care Partnerships Directorate,0,0,0,Policy
Oct-15,SC-1937,SC-003,Senior,Lyn Romeo,SCS2,"Director, Chief Social Worker",Social Care Local Government & Care Partnerships Directorate,85542,155000,159999,Policy
Oct-15,SC-089,SC-026,Senior,ELIMINATED,SCS1,Transforming Care Lead,Social Care Local Government & Care Partnerships Directorate,0,ND,,Policy
Oct-15,PHD074,PHD-068,Senior,N/D,SCS1,Abortion Medical Advisor,Public Health Directorate,0,ND,,Policy
Oct-15,PHD-070,PHD-019,Senior,ELIMINATED,SCS1,Deputy Director - Health & Wellbeing,Public Health Directorate,0,ND,,Policy
Oct-15,PHD075,PHD-065,Senior,N/D,SCS1,Interim National Medical Advisor,Public Health Directorate,0,ND,,Policy
Oct-15,CMO-008,CMO-002,Senior,Georgina Radford,SCS2,Deputy CMO,Chief Medical Officer's Private Office,0,105000,109999,Medicine
Oct-15,PHD-018,CMO-002,Senior,Professor John Watson,SCS2,Deputy CMO,Chief Medical Officer's Private Office,0,155000,159999,Medicine
Oct-15,SER-2418,SER-1945,Senior,ELIMINATED,SCS1,Deputy Director - Morecambe Bay Investigation Team,Strategy and External Relations,0,ND,,Policy
Oct-15,SC-085,SC-022,Senior,ELIMINATED,SCS1,"Deputy Director,",Social Care Local Government & Care Partnerships Directorate,0,ND,,Policy
Oct-15,IGT2355,IGT-2351,Senior,Nicole Mather,SCS2,Director of the Office for Life Sciences,"Innovation, Growth and Technology",551194,80000,84999,Operational Delivery
Oct-15,IGT2356,IGT2355,Senior,VACANT,SCS1,Deputy Director of Supply and Demand,"Innovation, Growth and Technology",0,ND,,Operational Delivery
Oct-15,FN132,FN-PICD-033,Senior,VACANT,SCS1,Deputy Director for Corporate & Private Finance,Finance & NHS,0,ND,,Finance
Oct-15,FN134,FN-PICD-108,Senior,VACANT,SCS1,Deputy Director Commercial Capability,Finance & NHS,0,ND,,Finance
Oct-15,FN138,FN-PICD-107,Senior,VACANT,SCS1,Head of Contract Management,Finance & NHS,0,ND,,Procurement
Oct-15,FN139,FN-PICD-107,Senior,VACANT,SCS1,Head of Supplier Relationship Management,Finance & NHS,0,ND,,Finance
Oct-15,PHD79,PHD-019,Senior,ELIMINATED,SCS1,Deputy Director - Health disability and employment,Public Health Directorate,0,ND,,Policy
Oct-15,IGT2364,IGT-2351,Senior,N/D,SCS1,Deputy Director - SRO NHS Mail,"Innovation, Growth and Technology",0,ND,,Operational Delivery
Oct-15,FN149,FN-NHSG-031,Senior,N/D,SCS1,Deputy Director - NHS Provider Policy,Finance & NHS,0,ND,,Policy
Oct-15,FN142,FN141,Senior,N/D,SCS1,"Deputy Director, Government Finance Academy",Finance & NHS,0,ND,,Finance
Oct-15,FN147,FN-PICD-108,Senior,N/D,SCS1,Deputy Director Lord Carter Review,Finance & NHS,835074,ND,,Finance
Oct-15,FN148,FN-PICD-033,Senior,N/D,SCS1,Contract Management Function Implementation Lead,Finance & NHS,0,ND,,Policy
Oct-15,IGT2369,IGT-010,Senior,N/D,SCS1,Cyber Security,"Innovation, Growth and Technology",0,ND,,Policy
Oct-15,IGT2370,IGT-010,Senior,N/D,SCS1,Cyber Security,"Innovation, Growth and Technology",0,ND,,Policy
Oct-15,IGT2371,IGT2368,Senior,N/D,SCS1,Accelerated Access Review Project member,"Innovation, Growth and Technology",0,ND,,Policy
Oct-15,,SER-004,Junior,,SEO,Senior Information Manager,Strategy and External Relations,0,33675,45769,Operational Delivery
Oct-15,,SER-004,Junior,,SEO,Senior Technical Adviser,Strategy and External Relations,0,33675,45769,Operational Delivery
Oct-15,,SER-004,Junior,,G7,Senior Finance Manager,Strategy and External Relations,0,45299,61976,Finance
Oct-15,,SER-004,Junior,,G6,Business Manager,Strategy and External Relations,0,57075,75035,Operational Delivery
Oct-15,,SER-004,Junior,,SEO,Senior Development Manager,Strategy and External Relations,0,33675,45769,Operational Delivery
Oct-15,,SER-004,Junior,,HEO,Business Support Officer,Strategy and External Relations,0,26492,37316,Operational Delivery
Oct-15,,SER-004,Junior,,G7,Senior HR Manager,Strategy and External Relations,0,45299,61976,Operational Delivery
Oct-15,,SER-004,Junior,,EO,Team Support Officer,Strategy and External Relations,0,21438,30275,Operational Delivery
