id,parentId,date,level,name,grade,jobTitle,unit,salaryCostOfReports,payFloor,payCeil,professionalOccupationalGroup
root,,,,,,,,,,,
1,root,Mar-13,Senior,Ursula Brennan,SCS4,Permanent Secretary,Ministry of Justice,0,180000,184999,Operational Delivery
2,1,Mar-13,Senior,Peter Handcock CBE,SCS3,"Chief Executive, HM Courts & Tribunals Service",Her Majesty's Courts and Tribunals Service (HMCTS),538952,145000,149999,Operational Delivery
4,2,Mar-13,Senior,Kevin Sadler,SCS2,"Director, Civil, Family and Tribunals",Her Majesty's Courts and Tribunals Service (HMCTS),0,95000,99999,Operational Delivery
5,77,Mar-13,Senior,N/D,SCS1,Director ICT HQ,Corporate Performance Group,0,N/A,,Information Technology
13,2,Mar-13,Senior,Guy Tomkins,SCS2,"Director, Crime",Her Majesty's Courts and Tribunals Service (HMCTS),291248,80000,84999,Operational Delivery
14,2,Mar-13,Senior,Paul Shipley,SCS2,HMCTS IT Director,Her Majesty's Courts and Tribunals Service (HMCTS),0,115000,119999,Information Technology
16,root,Mar-13,Senior,Eliminated,SCS1,Director of Estates,Her Majesty's Courts and Tribunals Service (HMCTS),0,N/A,,Operational Delivery
19,68,Mar-13,Senior,N/D,SCS1,Head of Finance Strategy & Planning,Corporate Performance Group,0,N/A,,Finance
20,77,Mar-13,Senior,N/D,SCS1,Head of Demand and Programme Office,Corporate Performance Group,0,N/A,,Programme and Project Management (PPM)
24,302,Mar-13,Senior,N/D,SCS1,Head of Crime for London,Her Majesty's Courts and Tribunals Service (HMCTS),0,N/A,,Operational Delivery
26,116,Mar-13,Senior,N/D,SCS1,Deputy Director for Customer Insight & Corporate Functions Analytical Services,Corporate Performance Group,0,N/A,,Operational Research
27,73,Mar-13,Senior,N/D,SCS1,Head of Payroll & Finance Services,Corporate Performance Group,0,N/A,,Finance
28,326,Mar-13,Senior,N/D,SCS1,Board Secretary and Head of TJ Strategy and Governance,Corporate Performance Group,0,N/A,,Planning
33,174,Mar-13,Senior,N/D,SCS1,Deputy Director - Justice Reform,Justice Policy Group,0,N/A,,Policy
40,50,Mar-13,Senior,N/D,SCS1,Public Guardian & Chief Executive,Office of the Public Guardian (OPG),0,N/A,,Operational Delivery
41,40,Mar-13,Senior,N/D,SCS1,Senior Legal Advisor to the Public Guardian,Office of the Public Guardian (OPG),13687582,N/A,,Law
43,188,Mar-13,Senior,N/D,SCS1,HMCTS Deputy Director Strategy and Change,Her Majesty's Courts and Tribunals Service (HMCTS),0,N/A,,Programme and Project Management (PPM)
44,2,Mar-13,Senior,N/D,SCS1,HMCTS Finance Director,Her Majesty's Courts and Tribunals Service (HMCTS),7953613,N/A,,Finance
45,1,Mar-13,Senior,N/D,SCS1,Principal Private Secretary to the Justice Secretary,Private Office,0,N/A,,Policy
47,326,Mar-13,Senior,N/D,SCS1,Head of ALB Governance Division,Corporate Performance Group,0,N/A,,Policy
48,2,Mar-13,Senior,Chris Ball,SCS2,"HR & Enforcement Director, HMCTS",Her Majesty's Courts and Tribunals Service (HMCTS),2838855,95000,99999,Human Resources
49,50,Mar-13,Senior,Pam Teare,SCS2,Director - Communications and Information Directorate,Corporate Performance Group,0,110000,114999,Operational Delivery
50,1,Mar-13,Senior,Antonia Romeo,SCS3,Director General - Transforming Justice,Corporate Performance Group,0,125000,129999,Operational Delivery
347,302,Mar-13,Senior,N/D,SCS1,"Cluster manager of Royal Courts of Justice group, HMCS",Her Majesty's Courts and Tribunals Service (HMCTS),24299088,N/A,,Operational Delivery
52,78,Mar-13,Senior,N/D,SCS1,Shared Services Programme Director,Corporate Performance Group,0,N/A,,Programme and Project Management (PPM)
55,116,Mar-13,Senior,N/D,SCS1,Deputy Director -,Corporate Performance Group,0,N/A,,Programme and Project Management (PPM)
58,49,Mar-13,Senior,N/D,SCS1,Head of Corporate Communication,Corporate Performance Group,0,N/A,,Communications
59,49,Mar-13,Senior,N/D,SCS1,Head of News,Corporate Performance Group,1199971,N/A,,Communications
346,325,Mar-13,Senior,N/D,SCS1,HR Director,Corporate Performance Group,421106,N/A,,Human Resources
65,68,Mar-13,Senior,N/D,SCS1,Financial Controller,Corporate Performance Group,0,N/A,,Finance
68,1,Mar-13,Senior,Ann Beasley,SCS3,"Director General, Finance and Corporate Services",Corporate Performance Group,0,140000,144999,Finance
69,68,Mar-13,Senior,Craig Watkins,SCS2,Director of Finance and Planning,Corporate Performance Group,0,110000,114999,Finance
70,68,Mar-13,Senior,N/D,SCS1,Head of Internal Audit and Assurance,Corporate Performance Group,0,N/A,,Internal Audit
72,136,Mar-13,Senior,N/D,SCS1,Head of Information & Human Rights Law,Corporate Performance Group,0,N/A,,Law
345,174,Mar-13,Senior,N/D,SCS1,Deputy Director Justice Policy Group,Justice Policy Group,0,N/A,,Policy
73,68,Mar-13,Senior,Gerry Smith,SCS2,Head of Shared Services,Corporate Performance Group,10374990,120000,124999,Operational Delivery
77,78,Mar-13,Senior,Andy Grant,SCS2,"Director, Service Management",Corporate Performance Group,0,140000,144999,Information Technology
78,68,Mar-13,Senior,Nick Ramsay,SCS2,Interim Chief Information Officer,Corporate Performance Group,3512,160000,164999,Information Technology
344,77,Mar-13,Senior,N/D,SCS1,Head of ICTIA,Corporate Performance Group,367308,N/A,,Information Technology
82,329,Mar-13,Senior,N/D,SCS1,Head of Strategy & Alignment,Corporate Performance Group,0,N/A,,Information Technology
83,68,Mar-13,Senior,Vincent Godfrey,SCS2,Director of Procurement,Corporate Performance Group,1344147,120000,124999,Procurement
84,83,Mar-13,Senior,N/D,SCS1,Head of Procurement Prison Portfolio,Corporate Performance Group,2644655,N/A,,Procurement
85,83,Mar-13,Senior,Vacant,SCS1,Head of Procurement Operation Services Portfolio,Corporate Performance Group,7323806,N/A,,Procurement
86,97,Mar-13,Senior,N/D,SCS1,Deputy Director Legal Aid and Legal Services Policy,Justice Policy Group,0,N/A,,Policy
91,116,Mar-13,Senior,N/D,SCS1,Deputy Director Offender Management and Sentencing Analytical Services,Corporate Performance Group,0,N/A,,Social Research
97,98,Mar-13,Senior,Helen Judge,SCS2,Policy Director,Justice Policy Group,390000,80000,84999,Policy
98,1,Mar-13,Senior,Helen Edwards,SCS3,"Director General, Justice Policy Group",Justice Policy Group,0,160000,164999,Policy
99,116,Mar-13,Senior,N/D,SCS1,Chief Statistician and Deputy Director for Justice Statistics Analytical Services,Corporate Performance Group,1961971,N/A,,Statisticians
107,116,Mar-13,Senior,N/D,SCS1,"Chief Economist and Deputy Director for Strategic Reform, Forecasting and Finance Analytical Services",Corporate Performance Group,2179041,N/A,,Economics
108,167,Mar-13,Senior,N/D,SCS1,Deputy Director,Justice Policy Group,0,N/A,,Policy
114,98,Mar-13,Senior,N/D,SCS1,Deputy Director,Justice Policy Group,546599,N/A,,Policy
115,97,Mar-13,Senior,N/D,SCS1,Deputy Director - Reducing Reoffending,Justice Policy Group,255219,N/A,,Policy
116,68,Mar-13,Senior,Rebecca Endean,SCS2,Director for Analytical Services,Corporate Performance Group,22757,85000,89999,Economics
119,325,Mar-13,Senior,N/D,SCS1,Head of Capacity Group,Corporate Performance Group,287901,N/A,,Human Resources
125,98,Mar-13,Senior,Catherine Lee,SCS2,Policy Director,Justice Policy Group,390000,85000,89999,Policy
348,97,Mar-13,Senior,N/D,SCS1,Deputy Director,Justice Policy Group,390000,N/A,,Policy
126,97,Mar-13,Senior,N/D,SCS1,Deputy Director - Sentencing Policy,Justice Policy Group,1109062,N/A,,Policy
136,68,Mar-13,Senior,Rosemary Davies,SCS2,Legal Director,Corporate Performance Group,0,95000,99999,Law
137,68,Mar-13,Senior,Jane Hill,SCS2,Legal Director,Corporate Performance Group,267818,65000,69999,Law
140,174,Mar-13,Senior,N/D,SCS1,"Deputy Director, Head of Human Rights and Security Policy",Justice Policy Group,478448,N/A,,Policy
153,136,Mar-13,Senior,N/D,SCS1,Deputy Director (Legal Aid and Legal Services Team),Corporate Performance Group,0,N/A,,Law
157,136,Mar-13,Senior,N/D,SCS1,Head of Criminal Law Team,Corporate Performance Group,0,N/A,,Policy
158,344,Mar-13,Senior,N/D,SCS1,Deputy Director - Judicial Reward and Pensions Reform,Corporate Performance Group,0,N/A,,Policy
159,136,Mar-13,Senior,N/D,SCS1,Head of Civil and Family Law,Corporate Performance Group,0,N/A,,Law
165,327,Mar-13,Senior,N/D,SCS1,Deputy Director Asset Management Unit,Corporate Performance Group,0,N/A,,Property and Asset Management
167,98,Mar-13,Senior,Mark Sweeney,SCS2,Policy Director,Justice Policy Group,420000,90000,94999,Policy
174,98,Mar-13,Senior,Paul Kett,SCS2,Policy Director,Justice Policy Group,378000,80000,84999,Policy
175,77,Mar-13,Senior,N/D,SCS1,"Head of Strategy, Planning and Operations, ICT",Corporate Performance Group,0,N/A,,Information Technology
177,327,Mar-13,Senior,N/D,SCS1,"Deputy Director, Interim Head of Strategy Programme Development Unit and Deputy Head of Progamme Management Unit",Corporate Performance Group,0,N/A,,Programme and Project Management (PPM)
178,77,Mar-13,Senior,N/D,SCS1,Head of Architecture and Assurance,Corporate Performance Group,752319,N/A,,Information Technology
180,77,Mar-13,Senior,N/D,SCS1,MOJ ICT Head of Delivery (NOMS Portfolio),Corporate Performance Group,0,N/A,,Programme and Project Management (PPM)
181,77,Mar-13,Senior,N/D,SCS1,"Deputy Director, Head of Delivery Management (HQ)",Corporate Performance Group,0,N/A,,Information Technology
182,77,Mar-13,Senior,N/D,SCS1,Head of Service Delivery,Corporate Performance Group,0,N/A,,Information Technology
183,77,Mar-13,Senior,N/D,SCS1,EUC Tower & Programme Transition Lead,Corporate Performance Group,0,N/A,,Information Technology
188,2,Mar-13,Senior,Sarah Albon,SCS2,"Director, HMCTS Strategy and Change",Her Majesty's Courts and Tribunals Service (HMCTS),4022224,80000,84999,Programme and Project Management (PPM)
215,125,Mar-13,Senior,N/D,SCS1,"Deputy Director, Civil & Family Justice",Justice Policy Group,805009,N/A,,Policy
217,83,Mar-13,Senior,N/D,SCS1,Head of Procurement (ICT),Corporate Performance Group,2096163,N/A,,Procurement
220,174,Mar-13,Senior,N/D,SCS1,Deputy Director - Judicial Policy,Justice Policy Group,399430,N/A,,Policy
301,4,Mar-13,Senior,N/D,SCS1,"Deputy Director, Civil & Family",Her Majesty's Courts and Tribunals Service (HMCTS),16848412,N/A,,Operational Delivery
302,2,Mar-13,Senior,Sheila Proudlock,SCS2,"Delivery Director, HMCTS London",Her Majesty's Courts and Tribunals Service (HMCTS),92588724,115000,119999,Operational Delivery
303,2,Mar-13,Senior,N/D,SCS1,Midlands Region Delivery Director,Her Majesty's Courts and Tribunals Service (HMCTS),53363509,N/A,,Operational Delivery
304,303,Mar-13,Senior,N/D,SCS1,Head of Crime for Midlands,Her Majesty's Courts and Tribunals Service (HMCTS),0,N/A,,Operational Delivery
306,2,Mar-13,Senior,N/D,SCS1,"Delivery Director, HMCTS North West",Her Majesty's Courts and Tribunals Service (HMCTS),47844582,N/A,,Operational Delivery
307,306,Mar-13,Senior,N/D,SCS1,Head of Crime for HMCTS North West,Her Majesty's Courts and Tribunals Service (HMCTS),0,N/A,,Operational Delivery
308,2,Mar-13,Senior,N/D,SCS1,"Delivery director, Scotland",Her Majesty's Courts and Tribunals Service (HMCTS),0,N/A,,Operational Delivery
309,2,Mar-13,Senior,N/D,SCS1,"Delivery Director, HMCTS South East",Her Majesty's Courts and Tribunals Service (HMCTS),48579778,N/A,,Operational Delivery
310,309,Mar-13,Senior,N/D,SCS1,Head of Crime for HMCTS South East,Her Majesty's Courts and Tribunals Service (HMCTS),0,N/A,,Operational Delivery
311,2,Mar-13,Senior,Sandra Aston,SCS1A,"Delivery Director, South West Region",Her Majesty's Courts and Tribunals Service (HMCTS),29821266,N/A,,Operational Delivery
312,311,Mar-13,Senior,N/D,SCS1,"Head of Crime, HMCTS South West",Her Majesty's Courts and Tribunals Service (HMCTS),0,N/A,,Operational Delivery
313,314,Mar-13,Senior,N/D,SCS1,"Head of Crime, HMCTS Wales",Her Majesty's Courts and Tribunals Service (HMCTS),21150530,N/A,,Operational Delivery
314,2,Mar-13,Senior,N/D,SCS1,"Delivery Director Wales, HMCTS",Her Majesty's Courts and Tribunals Service (HMCTS),0,N/A,,Operational Delivery
315,2,Mar-13,Senior,N/D,SCS1,Delivery Director HMCTS North East,Her Majesty's Courts and Tribunals Service (HMCTS),51266795,N/A,,Operational Delivery
316,315,Mar-13,Senior,N/D,SCS1,"Head of Crime, HMCTS North East",Her Majesty's Courts and Tribunals Service (HMCTS),34900052,N/A,,Operational Delivery
317,4,Mar-13,Senior,N/D,SCS1,"Deputy Director, HMCTS Tribunals",Her Majesty's Courts and Tribunals Service (HMCTS),1136754,N/A,,Operational Delivery
318,13,Mar-13,Senior,N/D,SCS1,Deputy Director HMCTS Crime (Magistrates),Her Majesty's Courts and Tribunals Service (HMCTS),1672365,N/A,,Operational Delivery
319,13,Mar-13,Senior,N/D,SCS1,Deputy Director HMCTS Crime (Crown),Her Majesty's Courts and Tribunals Service (HMCTS),816986,N/A,,Operational Delivery
320,302,Mar-13,Senior,Martin John,SCS1A,"Head of Civil, Family and Tribunals, HMCTS London",Her Majesty's Courts and Tribunals Service (HMCTS),0,N/A,,Operational Delivery
321,188,Mar-13,Senior,N/D,SCS1,"Deputy Director, Programme Director",Her Majesty's Courts and Tribunals Service (HMCTS),367691,N/A,,Programme and Project Management (PPM)
322,49,Mar-13,Senior,N/D,SCS1,Head of Information Operations,Corporate Performance Group,3420907,N/A,,Knowledge and Information Management (KIM)
323,325,Mar-13,Senior,N/D,SCS1,"Deputy Director, HR Strategy, Performance and Transformation",Corporate Performance Group,0,N/A,,Human Resources
324,325,Mar-13,Senior,N/D,SCS1,"Deputy Director, Reward, Employee Relations and Policy",Corporate Performance Group,412901,N/A,,Human Resources
325,50,Mar-13,Senior,Debbie Alder,SCS2,Group HR Director,Corporate Performance Group,0,90000,94999,Human Resources
326,50,Mar-13,Senior,Darren Tierney,SCS2,Director - Transforming Justice,Corporate Performance Group,0,80000,84999,Operational Delivery
327,50,Mar-13,Senior,Mark Read,SCS2,Interim Estate Director,Corporate Performance Group,0,85000,89999,Operational Delivery
329,174,Mar-13,Senior,N/D,SCS1,"Deputy Director, Criminal Justice Strategy, Justice Reform Directorate",Justice Policy Group,666301,N/A,,Policy
330,77,Mar-13,Senior,Peter Scott,SCS2,Chief Technology Officer,Corporate Performance Group,2243023,100000,104999,Information Technology
332,174,Mar-13,Senior,N/D,SCS1,Deputy Director,Justice Policy Group,190000,N/A,,Policy
333,78,Mar-13,Senior,N/D,SCS1,"Interim Director, Programme & Projects Delivery",Corporate Performance Group,0,N/A,,Information Technology
334,174,Mar-13,Senior,N/D,SCS1,Deputy Director,Justice Policy Group,767218,N/A,,Policy
335,174,Mar-13,Senior,N/D,SCS1,"Deputy Director, Information Rights and Devolution",Justice Policy Group,508850,N/A,,Policy
349,125,Mar-13,Senior,N/D,SCS1,Deputy Director-Youth Justice Policy Unit,Justice Policy Group,770246,N/A,,Policy
338,68,Mar-13,Senior,N/D,SCS1,"Deputy Director, Access to Justice Analytical Services",Corporate Performance Group,0,N/A,,Economics
341,68,Mar-13,Senior,N/D,SCS1,Departmental Trade Union Side,Corporate Performance Group,0,N/A,,Operational Delivery
343,4,Mar-13,Senior,N/D,SCS1,Deputy Director - National Back Office,Her Majesty's Courts and Tribunals Service (HMCTS),0,N/A,,Operational Delivery
uid-118,329,Mar-13,Junior,,Band A,Policy Manager,"Criminal Justice Strategy, Justice Reform Directorate",0,42034,67969,Policy
uid-119,329,Mar-13,Junior,,Band B,Senior Policy Adviser,"Criminal Justice Strategy, Justice Reform Directorate",0,29634,44964,Policy
uid-120,329,Mar-13,Junior,,Band C,Policy Adviser,"Criminal Justice Strategy, Justice Reform Directorate",0,21096,36061,Policy
uid-121,329,Mar-13,Junior,,Band C,Fastreamer,"Criminal Justice Strategy, Justice Reform Directorate",0,21096,36061,Policy
uid-122,329,Mar-13,Junior,,Band D,Policy Officer,"Criminal Justice Strategy, Justice Reform Directorate",0,17513,28000,Policy
uid-123,333,Mar-13,Junior,,Band A,Demand and Programme Office,Programme & Projects Delivery - ICT,0,42034,67969,Programme and Project Management (PPM)
uid-124,333,Mar-13,Junior,,Band B,Demand and Programme Office,Programme & Projects Delivery - ICT,0,29634,44964,Programme and Project Management (PPM)
uid-125,333,Mar-13,Junior,,Band C,Demand and Programme Office,Programme & Projects Delivery - ICT,0,21096,36061,Programme and Project Management (PPM)
uid-126,333,Mar-13,Junior,,Band D,Demand and Programme Office,Programme & Projects Delivery - ICT,0,17513,28000,Programme and Project Management (PPM)
uid-127,333,Mar-13,Junior,,Band A,Programme Manager,Programme & Projects Delivery - ICT,0,42034,67969,Information Technology
uid-128,333,Mar-13,Junior,,Band A,Senior Project Manager,Programme & Projects Delivery - ICT,0,42034,67969,Information Technology
uid-129,333,Mar-13,Junior,,Band B,Project Manager,Programme & Projects Delivery - ICT,0,29634,44964,Information Technology
uid-130,333,Mar-13,Junior,,Band C,Project Support Officer,Programme & Projects Delivery - ICT,0,21096,36061,Information Technology
uid-131,333,Mar-13,Junior,,Band D,Project Support Officer,Programme & Projects Delivery - ICT,0,17513,28000,Information Technology
uid-132,333,Mar-13,Junior,,Band D,Project Team Member,Programme & Projects Delivery - ICT,0,17513,28000,Information Technology
uid-133,333,Mar-13,Junior,,Band D,Business Solutions Support,Programme & Projects Delivery - ICT,0,17513,28000,Information Technology
uid-134,333,Mar-13,Junior,,Band A,Head of Solutions Development,Programme & Projects Delivery - ICT,0,42034,67969,Information Technology
uid-135,333,Mar-13,Junior,,Band B,Senior Analyst,Programme & Projects Delivery - ICT,0,29634,44964,Information Technology
uid-136,333,Mar-13,Junior,,Band B,Analyst,Programme & Projects Delivery - ICT,0,29634,44964,Information Technology
uid-137,333,Mar-13,Junior,,Band D,Analyst,Programme & Projects Delivery - ICT,0,17513,28000,Information Technology
uid-138,333,Mar-13,Junior,,Band C,Executive Assistant,Programme & Projects Delivery - ICT,0,21096,36061,Information Technology
uid-139,347,Mar-13,Junior,,Band B,Analyst,Rehabilitation Programme,0,29634,44964,Information Technology
uid-140,4,Mar-13,Junior,,Band A,Senior IT Manager,ICT Demand,0,42034,67969,Information Technology
uid-141,4,Mar-13,Junior,,Band A,IT Manager,ICT Demand,0,42034,67969,Information Technology
uid-142,4,Mar-13,Junior,,Band B,Business Support,ICT Demand,0,29634,44964,Information Technology
uid-143,4,Mar-13,Junior,,Band D,Executive Assistant,ICT Demand,0,17513,28000,Information Technology
uid-144,69,Mar-13,Junior,,Band A,Head of Planning and Operations,Information Technology,0,42034,67969,Information Technology
uid-145,347,Mar-13,Junior,,Band A,Senior Policy Adviser,Rehabilitation Programme,0,42034,67969,Policy
uid-146,347,Mar-13,Junior,,Band C,Policy Adviser,Rehabilitation Programme,0,21096,36061,Policy
uid-147,108,Mar-13,Junior,,Band A,Senior Policy Adviser,Criminal Law and Legal Policy,0,42034,67969,Policy
uid-148,108,Mar-13,Junior,,Band B,Senior Policy Adviser,Criminal Law and Legal Policy,0,29634,44964,Policy
uid-149,108,Mar-13,Junior,,Fast Streamer,Policy Adviser,Criminal Law and Legal Policy,0,27000,43400,Policy
uid-150,108,Mar-13,Junior,,Band C,Policy Adviser,Criminal Law and Legal Policy,0,21096,36061,Policy
uid-151,108,Mar-13,Junior,,Band D,Assistant Policy Advisor,Criminal Law and Legal Policy,0,17513,28000,Policy
uid-152,108,Mar-13,Junior,,Band E,Policy Support Officer,Criminal Law and Legal Policy,0,15935,22250,Policy
uid-153,114,Mar-13,Junior,,Band A,"Head of Culture Change, Capability and Group Coordination",Justice Policy Group,0,42034,67969,Policy
uid-154,114,Mar-13,Junior,,Band A,Policy Planning and Strategy Head,Justice Policy Group,0,42034,67969,Policy
uid-155,114,Mar-13,Junior,,Band A,Business Manager,Justice Policy Group,0,42034,67969,Policy
uid-156,114,Mar-13,Junior,,Band C,JPG Resources Lead,Justice Policy Group,0,21096,36061,Policy
uid-157,114,Mar-13,Junior,,Band C,Correspondence Manager,Justice Policy Group,0,21096,36061,Policy
uid-158,114,Mar-13,Junior,,Band C,Insight and Engagement Lead,Justice Policy Group,0,21096,36061,Policy
uid-159,114,Mar-13,Junior,,Band C,Policy Manager,Justice Policy Group,0,21096,36061,Policy
uid-160,114,Mar-13,Junior,,Band C,JPG Capability Lead,Justice Policy Group,0,21096,36061,Policy
uid-161,114,Mar-13,Junior,,Band D,Group Coordination Officer,Justice Policy Group,0,17513,28000,Policy
uid-162,114,Mar-13,Junior,,Band D,Correspondence Officer,Justice Policy Group,0,17513,28000,Policy
uid-163,114,Mar-13,Junior,,Band E,Policy support,Justice Policy Group,0,15935,22250,Policy
uid-164,114,Mar-13,Junior,,Band E,PA to Deputy Director,Justice Policy Group,0,15935,22250,Policy
uid-165,114,Mar-13,Junior,,Band E,Correspondence Officer,Justice Policy Group,0,15935,22250,Policy
uid-166,332,Mar-13,Junior,,Band A,Policy Manager,Justice Policy Group,0,42034,67969,Policy
uid-167,332,Mar-13,Junior,,Band B,Senior Policy Adviser,Justice Policy Group,0,29634,44964,Policy
uid-168,332,Mar-13,Junior,,Band C,Policy Adviser,Justice Policy Group,0,21096,36061,Policy
uid-169,332,Mar-13,Junior,,Band C,Fastreamer,Justice Policy Group,0,21096,36061,Policy
uid-170,332,Mar-13,Junior,,Band D,Policy Officer,Justice Policy Group,0,17513,28000,Policy
uid-171,332,Mar-13,Junior,,Band E,Policy Assistant,Justice Policy Group,0,15935,22250,Policy
uid-172,77,Mar-13,Junior,,Band A,Lead CSM Prisons,ICT Service Management,0,42034,67969,Information Technology
uid-173,77,Mar-13,Junior,,Band A,Lead CSM HMCTS,ICT Service Management,0,42034,67969,Information Technology
uid-174,77,Mar-13,Junior,,Band A,Lead CSM Probation,ICT Service Management,0,42034,67969,Information Technology
uid-175,77,Mar-13,Junior,,Band A,Lead CSM HQ,ICT Service Management,0,42034,67969,Information Technology
uid-176,175,Mar-13,Junior,,Band A,IT Business Manager,Information Technology,0,42034,67969,Information Technology
uid-177,175,Mar-13,Junior,,Band B,IT Business Manager,Information Technology,0,29634,44964,Information Technology
uid-178,175,Mar-13,Junior,,Band C,IT Business Manager,Information Technology,0,21096,36061,Information Technology
uid-179,182,Mar-13,Junior,,Band A,IT Service Manager,IT Service Delivery,0,42034,67969,Information Technology
uid-180,182,Mar-13,Junior,,Band B,IT Service Manager,IT Service Delivery,0,29634,44964,Information Technology
uid-181,182,Mar-13,Junior,,Band C,IT Service Manager,IT Service Delivery,0,21096,36061,Information Technology
uid-182,182,Mar-13,Junior,,Band D,IT Service Manager,IT Service Delivery,0,17513,28000,Information Technology
uid-183,323,Mar-13,Junior,,Band A,Head of Business Delivery,"HR Strategy, Performance and Transformation",0,42034,67969,Human Resources
uid-184,323,Mar-13,Junior,,Band A,Head of HR Strategy,"HR Strategy, Performance and Transformation",0,42034,67969,Human Resources
uid-185,323,Mar-13,Junior,,Band B,Deputy Head of Business Delivery,"HR Strategy, Performance and Transformation",0,29634,44964,Human Resources
uid-186,323,Mar-13,Junior,,Band C,Briefing and Correspondence Manager,"HR Strategy, Performance and Transformation",0,21096,36061,Human Resources
uid-187,323,Mar-13,Junior,,Band C,Business Delivery Support Officer,"HR Strategy, Performance and Transformation",0,21096,36061,Human Resources
uid-188,323,Mar-13,Junior,,Band C,HR Support Team Manager,"HR Strategy, Performance and Transformation",0,21096,36061,Human Resources
uid-189,323,Mar-13,Junior,,Band C,Honours Secretary,"HR Strategy, Performance and Transformation",0,21096,36061,Human Resources
uid-190,323,Mar-13,Junior,,Band D,HR Support Team administrator,"HR Strategy, Performance and Transformation",0,17513,28000,Human Resources
uid-191,323,Mar-13,Junior,,Band E,HR Support Team administrator,"HR Strategy, Performance and Transformation",0,15935,22250,Human Resources
uid-192,325,Mar-13,Junior,,Band A,Head of Employee Engagement,Human Resources,0,42034,67969,Human Resources
uid-193,325,Mar-13,Junior,,Band A,Head of Corporate Learning,Human Resources,0,42034,67969,Human Resources
uid-194,325,Mar-13,Junior,,Band A,Head of Corporate Equality,Human Resources,0,42034,67969,Human Resources
uid-195,325,Mar-13,Junior,,Band A,Head of Talent Management,Human Resources,0,42034,67969,Human Resources
uid-196,325,Mar-13,Junior,,Band C,Business Manager,Human Resources,0,21096,36061,Human Resources
uid-197,332,Mar-13,Junior,,Band A,Policy lead,CJS Operating Project,0,42034,67969,Policy
uid-198,332,Mar-13,Junior,,Band B,Policy manager,CJS Operating Project,0,29634,44964,Policy
uid-199,332,Mar-13,Junior,,Band B,Policy manager,CJS Operating Project,0,29634,44964,Policy
uid-200,332,Mar-13,Junior,,Fast streamer,Policy Manager,CJS Operating Project,0,27000,43400,Policy
uid-201,332,Mar-13,Junior,,Band D,Senior Personal Secretary,CJS Operating Project,0,17513,28000,Policy
uid-202,332,Mar-13,Junior,,Band E,Administration officer,CJS Operating Project,0,15935,22250,Policy
uid-203,59,Mar-13,Junior,,Band A,Chief Press Officers,Press Office,0,42034,67969,Communications
uid-204,59,Mar-13,Junior,,Band B,Senior Press officers,Press Office,0,29634,44964,Communications
uid-205,59,Mar-13,Junior,,Band C,Press Officer,Press Office,0,21096,36061,Communications
uid-206,19,Mar-13,Junior,,Band A,Senior Policy Manager,"Financial Policy, Planning, Governance and Capability",0,42034,67969,Policy
uid-207,19,Mar-13,Junior,,Band A,Senior Finance Manager,"Financial Policy, Planning, Governance and Capability",0,42034,67969,Finance
uid-208,19,Mar-13,Junior,,Band A,Programme Manager,"Financial Policy, Planning, Governance and Capability",0,42034,67969,Programme and Project Management (PPM)
uid-209,19,Mar-13,Junior,,Band B,Finance Analyst,"Financial Policy, Planning, Governance and Capability",0,29634,44964,Finance
uid-210,19,Mar-13,Junior,,Band B,Policy Manager,"Financial Policy, Planning, Governance and Capability",0,29634,44964,Policy
uid-211,19,Mar-13,Junior,,Band C,Business Manager,"Financial Policy, Planning, Governance and Capability",0,21096,36061,Operational delivery
uid-212,19,Mar-13,Junior,,Band C,Finance Trainee,"Financial Policy, Planning, Governance and Capability",0,21096,36061,Finance
